<!-- DSpace Custom Submit input form definition language -->


 <!ELEMENT input-forms (form-definitions, form-value-pairs) >

 <!ELEMENT form-definitions (form)+ >
 <!ELEMENT form (row)+ >
 <!ELEMENT row (field|relation-field)+ >
 <!ATTLIST form name NMTOKEN #REQUIRED>

 <!ELEMENT field (dc-schema, dc-element, dc-qualifier?, language?, repeatable?, label, style?, type-bind?, input-type, hint, required?, regex?, vocabulary?, visibility?, readonly?, acl?) >
 <!ELEMENT dc-schema (#PCDATA) >
 <!ELEMENT dc-element (#PCDATA) >
 <!ELEMENT dc-qualifier (#PCDATA) >
 <!ELEMENT language (#PCDATA)>
 <!ELEMENT type-bind (#PCDATA) >

 <!ELEMENT repeatable (#PCDATA) >
 <!ELEMENT label (#PCDATA) >
 <!ELEMENT style (#PCDATA) >
 <!ELEMENT input-type (#PCDATA)>

 <!ELEMENT hint (#PCDATA) >
 <!ELEMENT required (#PCDATA)>
 <!ELEMENT name-variants (#PCDATA)>
 <!ELEMENT regex (#PCDATA) >

 <!ELEMENT form-value-pairs (value-pairs)* >
 <!ELEMENT value-pairs (pair)+ >

 <!-- ***
        To assign a particular 'value-pairs' list to a particular dropdown 'input-type'
        field, as found on a particular form, put:
        - value-pairs/@value-pairs-name string into
           form/page/field/input-type/@value-pairs-name
        - form/page/field/@DCelement + '_' + form/field/DCqualifier into
           value-pairs/@dc-term
             (e.g. 'language_iso')
  -->
 <!ATTLIST value-pairs value-pairs-name CDATA #REQUIRED
                            dc-term   CDATA #REQUIRED
 >

 <!ELEMENT pair (displayed-value,stored-value) >
 <!ELEMENT displayed-value (#PCDATA)>
 <!ELEMENT stored-value (#PCDATA)>

 <!ATTLIST input-type value-pairs-name CDATA  #IMPLIED>

 <!ELEMENT vocabulary (#PCDATA) >

 <!ATTLIST vocabulary closed (true|false) "false">

 <!ELEMENT visibility (#PCDATA) >

 <!ATTLIST language value-pairs-name CDATA  #IMPLIED>

 <!ELEMENT readonly (#PCDATA) >

 <!-- ***
        Access control list for a field. Semicolon separated entries, each of the form
           policy=(allow|deny),action=(read|write),grantee-type=(user|group),grantee-id=(UUID or *)
        Site administrators always pass. An entry that allows one action implicitly denies
        the other, and an entry that cannot be parsed is dropped, leaving the field visible.
        This hides the field from the submission form payload only; it is not write path
        enforcement.
        WARNING: leave 'required' empty on any field carrying an acl. Metadata validation is
        acl unaware, so a field that is both required and acl hidden makes the submission
        permanently un-submittable for the users who cannot see it.
  -->
 <!ELEMENT acl (#PCDATA) >

<!ELEMENT relationship-type (#PCDATA) >
<!ELEMENT search-configuration (#PCDATA) >
<!ELEMENT filter (#PCDATA) >
<!ELEMENT externalsources (#PCDATA) >
<!ELEMENT relation-field (relationship-type, search-configuration, filter?, repeatable?, name-variants?, label, type-bind?, hint, linked-metadata-field?, externalsources?, required?, regex?, visibility?)>
<!ELEMENT linked-metadata-field (dc-schema, dc-element, dc-qualifier?, input-type)>
